{
  "schema_version": 1,
  "old_commit": "8d251601ca551fbd5c05451f1fb337fc4b75362c",
  "coverage_status": "partial: eight historical local raw/gray paths and seven exact-old-code replay goldens pass; 15 of 23 in-scope source/product paths pass, zero differences are pending, and eight remain blocked by path-specific missing evidence. OpenSnow and WU are excluded from this legacy-display scope by user decision.",
  "paths": [
    {
      "source": "au",
      "product": "composite",
      "path_id": "au/composite",
      "status": "passed",
      "blocked_reasons": [],
      "rule_version": "old-8d251601-au01-v1",
      "input_hashes": [
        "90cb0eeb4a8fecbaf0aa2559fc3d5b98a0a5f79c5078db1d707b24be25f4d777"
      ],
      "output_hash": "aa4d83a7b3245a0de4ba56b0f570917993db748110ba441c4813201039f8c08d",
      "scientific_status_unchanged": true,
      "old_path": "core/scrapers/au_scraper.py",
      "catalog_product_evidence": "python/radiust/resources/catalog.json",
      "source_inventory_evidence": "specs/001-radiust-v1-migration/source-inventory.md",
      "migration_evidence": "migration/sources/au.json",
      "old_config_verified": true,
      "source_baseline_verified": true
    },
    {
      "source": "bmkg",
      "product": "composite",
      "path_id": "bmkg/composite",
      "status": "blocked",
      "blocked_reasons": [
        "The old IDCOMP palette/parser rule is pinned, but the current public tile request returned HTTP 403 and no current tile artifact or frame exists in tests/fixtures/sources/bmkg/fixture.json; the old transform could not be run and there is no same-frame old gray baseline."
      ],
      "rule_version": "old-8d251601-bmkg-idcomp-v1",
      "input_hashes": [],
      "output_hash": null,
      "scientific_status_unchanged": true,
      "old_path": "core/tiles/radar.py",
      "catalog_product_evidence": "python/radiust/resources/catalog.json",
      "source_inventory_evidence": "specs/001-radiust-v1-migration/source-inventory.md",
      "migration_evidence": "migration/sources/bmkg.json",
      "old_config_verified": true,
      "source_baseline_verified": false
    },
    {
      "source": "ca",
      "product": "rain",
      "path_id": "ca/rain",
      "status": "passed",
      "blocked_reasons": [],
      "rule_version": "old-8d251601-ca-casft-replay-v1",
      "input_hashes": [
        "90d1df687644579822459a2527b8d300f8a3b4e0de73e226a7db62dab7fee5b0"
      ],
      "output_hash": "bbcca382104a917f9927813be2f7cdce385416d7c60c9e3e8154f55a789d67ba",
      "scientific_status_unchanged": true,
      "old_path": "core/scrapers/ca_scraper.py",
      "catalog_product_evidence": "python/radiust/resources/catalog.json",
      "source_inventory_evidence": "specs/001-radiust-v1-migration/source-inventory.md",
      "migration_evidence": "migration/sources/ca.json",
      "old_config_verified": true,
      "source_baseline_verified": true
    },
    {
      "source": "es",
      "product": "composite",
      "path_id": "es/composite",
      "status": "passed",
      "blocked_reasons": [],
      "rule_version": "old-8d251601-es-escomp-replay-v1",
      "input_hashes": [
        "baf34e1bc4ac94c77a78994bbc153e480e67b87681eb9473534237fac9a35c2f"
      ],
      "output_hash": "dc67ae6ce0af75f07ac22d7aed0c5e42ec972a5d380a616d4426a5243dc7859f",
      "scientific_status_unchanged": true,
      "old_path": "core/scrapers/es_aemet_scraper.py",
      "catalog_product_evidence": "python/radiust/resources/catalog.json",
      "source_inventory_evidence": "specs/001-radiust-v1-migration/source-inventory.md",
      "migration_evidence": "migration/sources/es.json",
      "old_config_verified": true,
      "source_baseline_verified": true
    },
    {
      "source": "fr",
      "product": "composite",
      "path_id": "fr/composite",
      "status": "passed",
      "blocked_reasons": [],
      "rule_version": "old-8d251601-fr-frcomp-replay-v1",
      "input_hashes": [
        "131c16940a13b31e1e51ceca1d44d1fbbfec6bde259a4b0646df941a1c62a248"
      ],
      "output_hash": "c8b056240dae308cf8ae88339c44cc07ebad15024bf742903df881374db70c56",
      "scientific_status_unchanged": true,
      "old_path": "core/scrapers/fr_meteofrance_scraper.py",
      "catalog_product_evidence": "python/radiust/resources/catalog.json",
      "source_inventory_evidence": "specs/001-radiust-v1-migration/source-inventory.md",
      "migration_evidence": "migration/sources/fr.json",
      "old_config_verified": true,
      "source_baseline_verified": true
    },
    {
      "source": "id",
      "product": "composite",
      "path_id": "id/composite",
      "status": "passed",
      "blocked_reasons": [],
      "rule_version": "old-8d251601-idac3-v1",
      "input_hashes": [
        "b7788761625d9557ceb12c13a2d92cbcaa034777d21c52cc6e7349ba15913170"
      ],
      "output_hash": "705d84039e4312907461b88c874a9139c8238a7c44d7fa7ee8baa92cc41a6bba",
      "scientific_status_unchanged": true,
      "old_path": "core/scrapers/id_scraper.py",
      "catalog_product_evidence": "python/radiust/resources/catalog.json",
      "source_inventory_evidence": "specs/001-radiust-v1-migration/source-inventory.md",
      "migration_evidence": "migration/sources/id.json",
      "old_config_verified": true,
      "source_baseline_verified": true
    },
    {
      "source": "id_sidarma",
      "product": "cmax",
      "path_id": "id_sidarma/cmax",
      "status": "blocked",
      "blocked_reasons": [
        "No old source-path identity or matched legal raw/gray pair for the current SIDARMA CMAX path is established."
      ],
      "rule_version": null,
      "input_hashes": [],
      "output_hash": null,
      "scientific_status_unchanged": true,
      "old_path": "core/scrapers/id_sidarma_scraper.py",
      "catalog_product_evidence": "python/radiust/resources/catalog.json",
      "source_inventory_evidence": "specs/001-radiust-v1-migration/source-inventory.md",
      "migration_evidence": "migration/sources/id_sidarma.json",
      "old_config_verified": false,
      "source_baseline_verified": false
    },
    {
      "source": "kr",
      "product": "composite",
      "path_id": "kr/composite",
      "status": "passed",
      "blocked_reasons": [],
      "rule_version": "old-8d251601-gng-v1",
      "input_hashes": [
        "a6c98d630fcd635d96ee75b63350e74978cd0d8749c1a701f9e7c27a2ce88c01"
      ],
      "output_hash": "589ee3c600640913500a4453cf76b428ba36eb782f4b9998317962514bda605e",
      "scientific_status_unchanged": true,
      "old_path": "core/scrapers/kr_scraper.py",
      "catalog_product_evidence": "python/radiust/resources/catalog.json",
      "source_inventory_evidence": "specs/001-radiust-v1-migration/source-inventory.md",
      "migration_evidence": "migration/sources/kr.json",
      "old_config_verified": true,
      "source_baseline_verified": true
    },
    {
      "source": "my",
      "product": "composite",
      "path_id": "my/composite/east",
      "status": "passed",
      "blocked_reasons": [],
      "rule_version": "old-8d251601-my-east-base-v1",
      "input_hashes": [
        "c2e7cb2293de39292c913c61c1405057f30a600eaed2b8fd33d62e04c6efaa9a"
      ],
      "output_hash": "4aebf01dfad273429ba4f568f396e11c14bc80919c1912dc8ccd33b79ac68c36",
      "scientific_status_unchanged": true,
      "old_path": "core/scrapers/my_scraper.py",
      "catalog_product_evidence": "python/radiust/resources/catalog.json",
      "source_inventory_evidence": "specs/001-radiust-v1-migration/source-inventory.md",
      "migration_evidence": "migration/sources/my.json",
      "old_config_verified": true,
      "source_baseline_verified": true
    },
    {
      "source": "my",
      "product": "composite",
      "path_id": "my/composite/peninsular",
      "status": "passed",
      "blocked_reasons": [],
      "rule_version": "old-8d251601-mycomp71-v1",
      "input_hashes": [
        "a60936811a91ae5f776759fc4072965c321eebc73431b78d3fba7fb1ebd7e68f"
      ],
      "output_hash": "d9a799448a0c644b9800485b8708215b4b9232524f267347fe088386fd5dae7f",
      "scientific_status_unchanged": true,
      "old_path": "core/scrapers/my_scraper.py",
      "catalog_product_evidence": "python/radiust/resources/catalog.json",
      "source_inventory_evidence": "specs/001-radiust-v1-migration/source-inventory.md",
      "migration_evidence": "migration/sources/my.json",
      "old_config_verified": true,
      "source_baseline_verified": true
    },
    {
      "source": "nz",
      "product": "rain",
      "path_id": "nz/rain",
      "status": "passed",
      "blocked_reasons": [],
      "rule_version": "old-8d251601-nz-nzau2-replay-v1",
      "input_hashes": [
        "0d98e9bc3ac0cd1b25d303a1b40db3641e316fc85db75554b0b8053c9607f85e"
      ],
      "output_hash": "4c950986bf8d02c2db9ac6a0c7ef70c2814f8f37ff5dc89e2b808d9af9a79ec6",
      "scientific_status_unchanged": true,
      "old_path": "core/scrapers/nz_scraper.py",
      "catalog_product_evidence": "python/radiust/resources/catalog.json",
      "source_inventory_evidence": "specs/001-radiust-v1-migration/source-inventory.md",
      "migration_evidence": "migration/sources/nz.json",
      "old_config_verified": true,
      "source_baseline_verified": true
    },
    {
      "source": "ph",
      "product": "composite",
      "path_id": "ph/composite",
      "status": "blocked",
      "blocked_reasons": [
        "The pinned PH/base.yaml rule is known, but the supplied old snapshot has no output/ph files, the pinned commit contains no PH raw/gray artifacts, and the current acquisition record has no verified raw; there is no source-matched pair to replay or compare."
      ],
      "rule_version": "old-8d251601-ph-base-v1",
      "input_hashes": [],
      "output_hash": null,
      "scientific_status_unchanged": true,
      "old_path": "core/scrapers/ph_scraper.py",
      "catalog_product_evidence": "python/radiust/resources/catalog.json",